{"accounting":{"command_workspace_bytes":16384,"data_bo_count":3,"device_request_bytes":118976,"host_bytes":84220,"peak_payload_bytes":4096,"reserved_bytes":102592,"submit_count":1,"task_count":1,"transfers":3},"actions":[{"attrs":{"cache":"input","source_binding":0,"src_col_offset":0,"src_row_offset":0,"src_row_stride":16,"transpose_source":false},"deps":[],"id":0,"inputs":[],"kind":"upload","origin":"host_pack:input","outputs":[0],"template_id":null},{"attrs":{"cache":"input","source_binding":1,"src_col_offset":0,"src_row_offset":0,"src_row_stride":16,"transpose_source":true},"deps":[],"id":1,"inputs":[],"kind":"upload","origin":"host_pack:weight","outputs":[1],"template_id":null},{"attrs":{"k0":0,"kt":16,"source_k_loop":null,"source_mn_tiling":null,"submit_group":"mm:0:0"},"deps":[0,1],"id":2,"inputs":[0,1],"kind":"npu_task","origin":"lowering:matmul:0","outputs":[2],"template_id":"co.mm.f16.v1"},{"attrs":{"binding_id":2,"submit_group":null},"deps":[2],"id":3,"inputs":[2],"kind":"download","origin":"host:download","outputs":[],"template_id":null}],"bindings":[{"dtype":"float16","id":0,"name":"A","role":"input","shape":[16,16]},{"dtype":"float16","id":1,"name":"B","role":"input","shape":[16,16]},{"dtype":"float16","id":2,"name":"Y","role":"output","shape":[16,16]}],"buffers":[{"alignment":16,"capacity":1024,"id":0,"layout_id":"co.cube.f16.v1","lifetime":[0,2],"must_not_share_bo":[],"offset":0,"padding_state":"zero","role":"input_slice","slot_id":0},{"alignment":16,"capacity":2048,"id":1,"layout_id":"co.weight.f16.v1","lifetime":[1,2],"must_not_share_bo":[],"offset":0,"padding_state":"zero","role":"weight","slot_id":1},{"alignment":16,"capacity":1024,"id":2,"layout_id":"co.cube.f16.v1","lifetime":[2,3],"must_not_share_bo":[],"offset":0,"padding_state":"finite","role":"output","slot_id":2}],"constants":[],"kind":"rkplan","name":"tilelang:matmul_tile","plan_hash":"4e18f19d5f104bf19ddf66a14becb76b6468e3b295e8ea1a25533fc2e60b5278","profile_hash":"50fa71281ad979ade1543d5350cd7ac584568fddb57412e39e4d4d9f2a3f2d79","publish":[{"binding_id":2,"cols":16,"dst_col":0,"dst_row":0,"name":"Y","rows":16,"view_id":2}],"schema_version":2,"source_hash":"Span(SourceName(/home/maoyu/Documents/code/rockchip-npu-notes/research/tilelang-rknpu/models/tilelang_matmul.py, 0xb700930), 13, 13, 1, 1048576)","submits":[{"core_policy":"single_core_per_submit","deps":[],"id":0,"mode":"chain","recipe_id":"linear_k_acc_v1","task_ids":[2]}],"views":[{"buffer_id":0,"id":0,"offset_bytes":0,"tensor":{"atom":8,"bytes":1024,"cols":16,"dtype":"float16","layout":"co.cube.f16.v1","physical_cols":32,"physical_rows":16,"rows":16},"valid_region":[0,16,0,16]},{"buffer_id":1,"id":1,"offset_bytes":0,"tensor":{"atom":32,"bytes":2048,"cols":16,"dtype":"float16","layout":"co.weight.f16.v1","physical_cols":32,"physical_rows":32,"rows":16},"valid_region":[0,16,0,16]},{"buffer_id":2,"id":2,"offset_bytes":0,"tensor":{"atom":8,"bytes":1024,"cols":16,"dtype":"float16","layout":"co.cube.f16.v1","physical_cols":32,"physical_rows":16,"rows":16},"valid_region":[0,16,0,16]}]}