{"accounting":{"command_workspace_bytes":32768,"data_bo_count":10,"device_request_bytes":388736,"host_bytes":87296,"peak_payload_bytes":27648,"reserved_bytes":355968,"submit_count":4,"task_count":5,"transfers":6},"actions":[{"attrs":{"cache":"input","source_binding":0,"src_col_offset":0,"src_row_offset":0,"src_row_stride":64,"transpose_source":false},"deps":[],"id":0,"inputs":[],"kind":"upload","origin":"host_pack:dataflow","outputs":[0],"template_id":null},{"attrs":{"cache":"constant","source_binding":1,"src_col_offset":0,"src_row_offset":0,"src_row_stride":32,"transpose_source":true},"deps":[],"id":1,"inputs":[],"kind":"upload","origin":"host_pack:dataflow","outputs":[1],"template_id":null},{"attrs":{"cache":"constant","source_binding":2,"src_col_offset":0,"src_row_offset":0,"src_row_stride":64,"transpose_source":true},"deps":[],"id":2,"inputs":[],"kind":"upload","origin":"host_pack:dataflow","outputs":[2],"template_id":null},{"attrs":{"cache":"constant","source_binding":4,"src_col_offset":0,"src_row_offset":0,"src_row_stride":32,"transpose_source":false},"deps":[],"id":3,"inputs":[],"kind":"upload","origin":"lowering:identity","outputs":[3],"template_id":null},{"attrs":{"cache":"constant","source_binding":5,"src_col_offset":0,"src_row_offset":0,"src_row_stride":64,"transpose_source":false},"deps":[],"id":4,"inputs":[],"kind":"upload","origin":"lowering:identity","outputs":[4],"template_id":null},{"attrs":{"k0":0,"kt":64,"source_k_loop":null,"submit_group":"mm:dataflow:0"},"deps":[0,1],"id":5,"inputs":[0,1],"kind":"npu_task","origin":"lowering:dataflow:matmul:0","outputs":[5],"template_id":"co.mm.f16.v1"},{"attrs":{"chunk_index":0,"submit_group":"act:dataflow:1"},"deps":[5],"id":6,"inputs":[7],"kind":"npu_task","origin":"lowering:silu:lut:0","outputs":[8],"template_id":"co.lut.sigmoid.f16.v1"},{"attrs":{"submit_group":"act:dataflow:1"},"deps":[6,3],"id":7,"inputs":[5,6,3],"kind":"npu_task","origin":"lowering:silu:mul","outputs":[9],"template_id":"co.ew_mul.f16.v1"},{"attrs":{"k0":0,"kt":32,"source_k_loop":null,"submit_group":"mm:dataflow:2"},"deps":[7,2],"id":8,"inputs":[9,2],"kind":"npu_task","origin":"lowering:dataflow:matmul:2","outputs":[10],"template_id":"co.mm.f16.v1"},{"attrs":{"submit_group":"ew:dataflow:3"},"deps":[8,0,4],"id":9,"inputs":[10,0,4],"kind":"npu_task","origin":"lowering:dataflow:add","outputs":[11],"template_id":"co.ew_add.f16.v1"},{"attrs":{"binding_id":3,"submit_group":null},"deps":[9],"id":10,"inputs":[11],"kind":"download","origin":"host:download","outputs":[],"template_id":null}],"bindings":[{"dtype":"float16","id":0,"name":"X","role":"input","shape":[13,64]},{"dtype":"float16","id":1,"name":"W1","role":"constant","shape":[64,32]},{"dtype":"float16","id":2,"name":"W2","role":"constant","shape":[32,64]},{"dtype":"float16","id":3,"name":"Y","role":"output","shape":[13,64]},{"dtype":"float16","id":4,"name":"__identity_32","role":"constant","shape":[32,32]},{"dtype":"float16","id":5,"name":"__identity_64","role":"constant","shape":[64,64]}],"buffers":[{"alignment":16,"capacity":2048,"id":0,"layout_id":"co.cube.f16.v1","lifetime":[0,9],"must_not_share_bo":[],"offset":0,"padding_state":"zero","role":"input_slice","slot_id":0},{"alignment":16,"capacity":4096,"id":1,"layout_id":"co.weight.f16.v1","lifetime":[1,5],"must_not_share_bo":[],"offset":0,"padding_state":"zero","role":"weight","slot_id":1},{"alignment":16,"capacity":4096,"id":2,"layout_id":"co.weight.f16.v1","lifetime":[2,8],"must_not_share_bo":[],"offset":0,"padding_state":"zero","role":"weight","slot_id":2},{"alignment":16,"capacity":2048,"id":3,"layout_id":"co.weight.f16.v1","lifetime":[3,7],"must_not_share_bo":[],"offset":0,"padding_state":"zero","role":"identity","slot_id":3},{"alignment":16,"capacity":8192,"id":4,"layout_id":"co.weight.f16.v1","lifetime":[4,9],"must_not_share_bo":[],"offset":0,"padding_state":"zero","role":"identity","slot_id":4},{"alignment":16,"capacity":1024,"id":5,"layout_id":"co.cube.f16.v1","lifetime":[5,7],"must_not_share_bo":[],"offset":0,"padding_state":"finite","role":"accumulator","slot_id":5},{"alignment":16,"capacity":1024,"id":6,"layout_id":"co.cube.f16.v1","lifetime":[6,7],"must_not_share_bo":[],"offset":0,"padding_state":"finite","role":"gate","slot_id":6},{"alignment":16,"capacity":1024,"id":7,"layout_id":"co.cube.f16.v1","lifetime":[7,8],"must_not_share_bo":[],"offset":0,"padding_state":"finite","role":"workspace","slot_id":7},{"alignment":16,"capacity":2048,"id":8,"layout_id":"co.cube.f16.v1","lifetime":[8,9],"must_not_share_bo":[],"offset":0,"padding_state":"finite","role":"accumulator","slot_id":8},{"alignment":16,"capacity":2048,"id":9,"layout_id":"co.cube.f16.v1","lifetime":[9,10],"must_not_share_bo":[],"offset":0,"padding_state":"finite","role":"output","slot_id":9}],"constants":[{"binding_id":1,"dtype":"float16","name":"W1","nbytes":4096,"pack_key":"f16:host-contract:64x32:v1","sha256":"3db921b1518ad961d08dc543c886df77164827583c197328da99c5c0f04eca59","shape":[64,32]},{"binding_id":2,"dtype":"float16","name":"W2","nbytes":4096,"pack_key":"f16:host-contract:32x64:v1","sha256":"bda636681626e98c59bd180152c7299adf486206791555e523d656c1e13cf1ba","shape":[32,64]},{"binding_id":4,"dtype":"float16","generator":"identity","name":"__identity_32","nbytes":2048,"pack_key":"identity:f16:32:v1","sha256":"9ee513848c4e750ecce55e9ea0d63efda24b034fa5bec1d50028d323c5fdb5c1","shape":[32,32]},{"binding_id":5,"dtype":"float16","generator":"identity","name":"__identity_64","nbytes":8192,"pack_key":"identity:f16:64:v1","sha256":"90fca671e478c0442955ebf59e432ea8abddccd315c2b722b9436a4a0f92f0a5","shape":[64,64]}],"kind":"rkplan","name":"tilelang:kernel","plan_hash":"79270e27410cc08206fb4a2969b756ca8b37664f3356c8ad7e282d1fb9b95d0d","profile_hash":"954d071351959ddbe2bb7351de196c6b45f6b5bcd6f81f603b649e3e62eb692d","publish":[{"binding_id":3,"cols":64,"dst_col":0,"dst_row":0,"name":"Y","rows":13,"view_id":11}],"schema_version":2,"source_hash":"Span(SourceName(/home/maoyu/Documents/code/rockchip-npu-notes/research/tilelang-rknpu/tests/fixtures/tilelang_silu_proj.py, 0x101b49c0), 27, 27, 1, 1048576)","submits":[{"core_policy":"single_core_per_submit","deps":[],"id":0,"mode":"chain","recipe_id":"linear_k_acc_v1","task_ids":[5]},{"core_policy":"single_core_per_submit","deps":[0],"id":1,"mode":"chain","recipe_id":"gate_ew_v1","task_ids":[6,7]},{"core_policy":"single_core_per_submit","deps":[1],"id":2,"mode":"chain","recipe_id":"linear_k_acc_v1","task_ids":[8]},{"core_policy":"single_core_per_submit","deps":[2],"id":3,"mode":"chain","recipe_id":"gate_ew_v1","task_ids":[9]}],"views":[{"buffer_id":0,"id":0,"offset_bytes":0,"tensor":{"atom":8,"bytes":2048,"cols":64,"dtype":"float16","layout":"co.cube.f16.v1","physical_cols":64,"physical_rows":16,"rows":13},"valid_region":[0,13,0,64]},{"buffer_id":1,"id":1,"offset_bytes":0,"tensor":{"atom":32,"bytes":4096,"cols":64,"dtype":"float16","layout":"co.weight.f16.v1","physical_cols":64,"physical_rows":32,"rows":32},"valid_region":[0,32,0,64]},{"buffer_id":2,"id":2,"offset_bytes":0,"tensor":{"atom":32,"bytes":4096,"cols":32,"dtype":"float16","layout":"co.weight.f16.v1","physical_cols":32,"physical_rows":64,"rows":64},"valid_region":[0,64,0,32]},{"buffer_id":3,"id":3,"offset_bytes":0,"tensor":{"atom":32,"bytes":2048,"cols":32,"dtype":"float16","layout":"co.weight.f16.v1","physical_cols":32,"physical_rows":32,"rows":32},"valid_region":[0,32,0,32]},{"buffer_id":4,"id":4,"offset_bytes":0,"tensor":{"atom":32,"bytes":8192,"cols":64,"dtype":"float16","layout":"co.weight.f16.v1","physical_cols":64,"physical_rows":64,"rows":64},"valid_region":[0,64,0,64]},{"buffer_id":5,"id":5,"offset_bytes":0,"tensor":{"atom":8,"bytes":1024,"cols":32,"dtype":"float16","layout":"co.cube.f16.v1","physical_cols":32,"physical_rows":16,"rows":13},"valid_region":[0,13,0,32]},{"buffer_id":6,"id":6,"offset_bytes":0,"tensor":{"atom":8,"bytes":1024,"cols":32,"dtype":"float16","layout":"co.cube.f16.v1","physical_cols":32,"physical_rows":16,"rows":13},"valid_region":[0,13,0,32]},{"buffer_id":5,"id":7,"offset_bytes":0,"tensor":{"atom":1,"bytes":1024,"cols":512,"dtype":"float16","layout":"co.linear.f16.v1","physical_cols":512,"physical_rows":1,"rows":1},"valid_region":[0,1,0,512]},{"buffer_id":6,"id":8,"offset_bytes":0,"tensor":{"atom":1,"bytes":1024,"cols":512,"dtype":"float16","layout":"co.linear.f16.v1","physical_cols":512,"physical_rows":1,"rows":1},"valid_region":[0,1,0,512]},{"buffer_id":7,"id":9,"offset_bytes":0,"tensor":{"atom":8,"bytes":1024,"cols":32,"dtype":"float16","layout":"co.cube.f16.v1","physical_cols":32,"physical_rows":16,"rows":13},"valid_region":[0,13,0,32]},{"buffer_id":8,"id":10,"offset_bytes":0,"tensor":{"atom":8,"bytes":2048,"cols":64,"dtype":"float16","layout":"co.cube.f16.v1","physical_cols":64,"physical_rows":16,"rows":13},"valid_region":[0,13,0,64]},{"buffer_id":9,"id":11,"offset_bytes":0,"tensor":{"atom":8,"bytes":2048,"cols":64,"dtype":"float16","layout":"co.cube.f16.v1","physical_cols":64,"physical_rows":16,"rows":13},"valid_region":[0,13,0,64]}]}