{"accounting":{"command_workspace_bytes":16384,"data_bo_count":5,"device_request_bytes":224064,"host_bytes":118396,"peak_payload_bytes":43520,"reserved_bytes":207680,"submit_count":3,"task_count":3,"transfers":7},"actions":[{"attrs":{"cache":"input","source_binding":0,"src_col_offset":0,"src_row_offset":0,"src_row_stride":64,"transpose_source":false},"deps":[],"id":0,"inputs":[],"kind":"upload","origin":"host_pack:input","outputs":[0],"template_id":null},{"attrs":{"cache":"input","source_binding":1,"src_col_offset":0,"src_row_offset":0,"src_row_stride":256,"transpose_source":true},"deps":[],"id":1,"inputs":[],"kind":"upload","origin":"host_pack:weight","outputs":[1],"template_id":null},{"attrs":{"applied_schedule":{"accumulation":"ordered_ascending_f16_writeback","k_tile":256,"kind":"mn_tiles_v1","order":"m_major","tile_m":1,"tile_n":256},"k0":0,"k_padding":0,"k_physical_extent":64,"kt":64,"source_k_loop":{"k_blocks":[{"extent":64,"index":0,"k0":0}],"k_tail":64,"logical_k":64,"lowering_k_tile":256,"narrowing_base":"explicit FP16 after each K block","pipeline_hint_dropped":false,"rounding_points":"after_each_k_block","source_k_block":256,"source_k_trips":1,"source_loop_annotations":{},"source_rounding":"explicit_per_k_fp16","tail_contract":{"form":"guarded_rect_tail_v1","grid":{"x":1,"y":3},"guarded_reads":{"A":[3,64],"B":[64,256]},"guarded_write":[3,256],"k_blocks":[{"extent":64,"index":0,"k0":0}],"k_trips":1,"physical_k_tile":256,"physical_padding":"zero","rounding_points":"after_each_k_block","tail_physical_extent":64,"tails":{"K":64,"M":1,"N":256},"tiles":{"K":256,"M":1,"N":256},"zero_fill":["A_tile_each_k_iteration","B_tile_each_k_iteration"]}},"source_k_rounding":"explicit_per_k_fp16","source_mn_tiling":{"block_m":1,"block_n":256,"coverage":"ragged_tail","grid_x":1,"grid_y":3,"m_tail":1,"n_tail":256},"source_schedule":{"accumulation":"ordered_ascending_f16_writeback","k_tile":256,"kind":"mn_tiles_v1","order":"m_major","tile_m":1,"tile_n":256},"submit_group":"mm:0:0"},"deps":[0,1],"id":2,"inputs":[0,1],"kind":"npu_task","origin":"lowering:matmul:0","outputs":[2],"template_id":"co.mm.f16.v1"},{"attrs":{"binding_id":2,"submit_group":null},"deps":[2],"id":3,"inputs":[2],"kind":"download","origin":"host:download","outputs":[],"template_id":null},{"attrs":{"cache":"input","source_binding":0,"src_col_offset":0,"src_row_offset":1,"src_row_stride":64,"transpose_source":false},"deps":[],"id":4,"inputs":[],"kind":"upload","origin":"host_pack:input","outputs":[3],"template_id":null},{"attrs":{"applied_schedule":{"accumulation":"ordered_ascending_f16_writeback","k_tile":256,"kind":"mn_tiles_v1","order":"m_major","tile_m":1,"tile_n":256},"k0":0,"k_padding":0,"k_physical_extent":64,"kt":64,"source_k_loop":{"k_blocks":[{"extent":64,"index":0,"k0":0}],"k_tail":64,"logical_k":64,"lowering_k_tile":256,"narrowing_base":"explicit FP16 after each K block","pipeline_hint_dropped":false,"rounding_points":"after_each_k_block","source_k_block":256,"source_k_trips":1,"source_loop_annotations":{},"source_rounding":"explicit_per_k_fp16","tail_contract":{"form":"guarded_rect_tail_v1","grid":{"x":1,"y":3},"guarded_reads":{"A":[3,64],"B":[64,256]},"guarded_write":[3,256],"k_blocks":[{"extent":64,"index":0,"k0":0}],"k_trips":1,"physical_k_tile":256,"physical_padding":"zero","rounding_points":"after_each_k_block","tail_physical_extent":64,"tails":{"K":64,"M":1,"N":256},"tiles":{"K":256,"M":1,"N":256},"zero_fill":["A_tile_each_k_iteration","B_tile_each_k_iteration"]}},"source_k_rounding":"explicit_per_k_fp16","source_mn_tiling":{"block_m":1,"block_n":256,"coverage":"ragged_tail","grid_x":1,"grid_y":3,"m_tail":1,"n_tail":256},"source_schedule":{"accumulation":"ordered_ascending_f16_writeback","k_tile":256,"kind":"mn_tiles_v1","order":"m_major","tile_m":1,"tile_n":256},"submit_group":"mm:1:0"},"deps":[4,1,2],"id":5,"inputs":[3,1],"kind":"npu_task","origin":"lowering:matmul:0","outputs":[4],"template_id":"co.mm.f16.v1"},{"attrs":{"binding_id":2,"submit_group":null},"deps":[5],"id":6,"inputs":[4],"kind":"download","origin":"host:download","outputs":[],"template_id":null},{"attrs":{"cache":"input","source_binding":0,"src_col_offset":0,"src_row_offset":2,"src_row_stride":64,"transpose_source":false},"deps":[],"id":7,"inputs":[],"kind":"upload","origin":"host_pack:input","outputs":[5],"template_id":null},{"attrs":{"applied_schedule":{"accumulation":"ordered_ascending_f16_writeback","k_tile":256,"kind":"mn_tiles_v1","order":"m_major","tile_m":1,"tile_n":256},"k0":0,"k_padding":0,"k_physical_extent":64,"kt":64,"source_k_loop":{"k_blocks":[{"extent":64,"index":0,"k0":0}],"k_tail":64,"logical_k":64,"lowering_k_tile":256,"narrowing_base":"explicit FP16 after each K block","pipeline_hint_dropped":false,"rounding_points":"after_each_k_block","source_k_block":256,"source_k_trips":1,"source_loop_annotations":{},"source_rounding":"explicit_per_k_fp16","tail_contract":{"form":"guarded_rect_tail_v1","grid":{"x":1,"y":3},"guarded_reads":{"A":[3,64],"B":[64,256]},"guarded_write":[3,256],"k_blocks":[{"extent":64,"index":0,"k0":0}],"k_trips":1,"physical_k_tile":256,"physical_padding":"zero","rounding_points":"after_each_k_block","tail_physical_extent":64,"tails":{"K":64,"M":1,"N":256},"tiles":{"K":256,"M":1,"N":256},"zero_fill":["A_tile_each_k_iteration","B_tile_each_k_iteration"]}},"source_k_rounding":"explicit_per_k_fp16","source_mn_tiling":{"block_m":1,"block_n":256,"coverage":"ragged_tail","grid_x":1,"grid_y":3,"m_tail":1,"n_tail":256},"source_schedule":{"accumulation":"ordered_ascending_f16_writeback","k_tile":256,"kind":"mn_tiles_v1","order":"m_major","tile_m":1,"tile_n":256},"submit_group":"mm:2:0"},"deps":[7,1,5],"id":8,"inputs":[5,1],"kind":"npu_task","origin":"lowering:matmul:0","outputs":[6],"template_id":"co.mm.f16.v1"},{"attrs":{"binding_id":2,"submit_group":null},"deps":[8],"id":9,"inputs":[6],"kind":"download","origin":"host:download","outputs":[],"template_id":null}],"bindings":[{"dtype":"float16","id":0,"name":"A","role":"input","shape":[3,64]},{"dtype":"float16","id":1,"name":"B","role":"input","shape":[64,256]},{"dtype":"float16","id":2,"name":"Y","role":"output","shape":[3,256]}],"budget_policy":{"device_budget_bytes":268435456,"host_budget_bytes":268435456,"schema_version":1},"buffers":[{"alignment":16,"capacity":1536,"id":0,"layout_id":"co.cube.f16.v1","lifetime":[0,2],"must_not_share_bo":[],"offset":0,"padding_state":"zero","role":"input_slice","slot_id":0},{"alignment":16,"capacity":32768,"id":1,"layout_id":"co.weight.f16.v1","lifetime":[1,8],"must_not_share_bo":[],"offset":0,"padding_state":"zero","role":"weight","slot_id":1},{"alignment":16,"capacity":6144,"id":2,"layout_id":"co.cube.f16.v1","lifetime":[2,3],"must_not_share_bo":[],"offset":0,"padding_state":"finite","role":"output","slot_id":2},{"alignment":16,"capacity":1536,"id":3,"layout_id":"co.cube.f16.v1","lifetime":[4,5],"must_not_share_bo":[],"offset":0,"padding_state":"zero","role":"input_slice","slot_id":3},{"alignment":16,"capacity":6144,"id":4,"layout_id":"co.cube.f16.v1","lifetime":[5,6],"must_not_share_bo":[],"offset":0,"padding_state":"finite","role":"output","slot_id":2},{"alignment":16,"capacity":1536,"id":5,"layout_id":"co.cube.f16.v1","lifetime":[7,8],"must_not_share_bo":[],"offset":0,"padding_state":"zero","role":"input_slice","slot_id":4},{"alignment":16,"capacity":6144,"id":6,"layout_id":"co.cube.f16.v1","lifetime":[8,9],"must_not_share_bo":[],"offset":0,"padding_state":"finite","role":"output","slot_id":2}],"constants":[],"kind":"rkplan","name":"tilelang:matmul_tiled_tail","plan_hash":"f4af3261b70c5846d6ec03c4d355e06ba05bdcb0768a178fca307597d6631aca","profile_hash":"7ef710bb19372e71f15994f363bd2542b4ef39b1ad35a36fa6ec787e61461dd1","publish":[{"binding_id":2,"cols":256,"dst_col":0,"dst_row":0,"name":"Y","rows":1,"view_id":2},{"binding_id":2,"cols":256,"dst_col":0,"dst_row":1,"name":"Y","rows":1,"view_id":4},{"binding_id":2,"cols":256,"dst_col":0,"dst_row":2,"name":"Y","rows":1,"view_id":6}],"schema_version":2,"source_hash":"Span(SourceName(models/tilelang_matmul.py#sha256:968bcda5af93d0d1, 0x0), 126, 126, 1, 1048576)","submits":[{"core_policy":"single_core_per_submit","deps":[],"id":0,"mode":"chain","recipe_id":"linear_k_acc_v1","task_ids":[2]},{"core_policy":"single_core_per_submit","deps":[0],"id":1,"mode":"chain","recipe_id":"linear_k_acc_v1","task_ids":[5]},{"core_policy":"single_core_per_submit","deps":[1],"id":2,"mode":"chain","recipe_id":"linear_k_acc_v1","task_ids":[8]}],"views":[{"buffer_id":0,"id":0,"offset_bytes":0,"tensor":{"atom":8,"bytes":1536,"cols":64,"dtype":"float16","layout":"co.cube.f16.v1","physical_cols":64,"physical_rows":12,"rows":1},"valid_region":[0,1,0,64]},{"buffer_id":1,"id":1,"offset_bytes":0,"tensor":{"atom":32,"bytes":32768,"cols":64,"dtype":"float16","layout":"co.weight.f16.v1","physical_cols":64,"physical_rows":256,"rows":256},"valid_region":[0,256,0,64]},{"buffer_id":2,"id":2,"offset_bytes":0,"tensor":{"atom":8,"bytes":6144,"cols":256,"dtype":"float16","layout":"co.cube.f16.v1","physical_cols":256,"physical_rows":12,"rows":1},"valid_region":[0,1,0,256]},{"buffer_id":3,"id":3,"offset_bytes":0,"tensor":{"atom":8,"bytes":1536,"cols":64,"dtype":"float16","layout":"co.cube.f16.v1","physical_cols":64,"physical_rows":12,"rows":1},"valid_region":[0,1,0,64]},{"buffer_id":4,"id":4,"offset_bytes":0,"tensor":{"atom":8,"bytes":6144,"cols":256,"dtype":"float16","layout":"co.cube.f16.v1","physical_cols":256,"physical_rows":12,"rows":1},"valid_region":[0,1,0,256]},{"buffer_id":5,"id":5,"offset_bytes":0,"tensor":{"atom":8,"bytes":1536,"cols":64,"dtype":"float16","layout":"co.cube.f16.v1","physical_cols":64,"physical_rows":12,"rows":1},"valid_region":[0,1,0,64]},{"buffer_id":6,"id":6,"offset_bytes":0,"tensor":{"atom":8,"bytes":6144,"cols":256,"dtype":"float16","layout":"co.cube.f16.v1","physical_cols":256,"physical_rows":12,"rows":1},"valid_region":[0,1,0,256]}]}