{"accounting":{"command_workspace_bytes":16384,"data_bo_count":6,"device_request_bytes":263552,"host_bytes":90038,"peak_payload_bytes":50176,"reserved_bytes":247168,"submit_count":2,"task_count":2,"transfers":5},"actions":[{"attrs":{"cache":"input","source_binding":0,"src_col_offset":0,"src_row_offset":0,"src_row_stride":257,"transpose_source":false},"deps":[],"id":0,"inputs":[],"kind":"upload","origin":"host_pack:input","outputs":[0],"template_id":null},{"attrs":{"cache":"constant","source_binding":1,"src_col_offset":0,"src_row_offset":0,"src_row_stride":33,"transpose_source":true},"deps":[],"id":1,"inputs":[],"kind":"upload","origin":"host_pack:weight","outputs":[1],"template_id":null},{"attrs":{"cache":"input","source_binding":0,"src_col_offset":256,"src_row_offset":0,"src_row_stride":257,"transpose_source":false},"deps":[],"id":2,"inputs":[],"kind":"upload","origin":"host_pack:input","outputs":[2],"template_id":null},{"attrs":{"cache":"constant","source_binding":1,"src_col_offset":0,"src_row_offset":256,"src_row_stride":33,"transpose_source":true},"deps":[],"id":3,"inputs":[],"kind":"upload","origin":"host_pack:weight","outputs":[3],"template_id":null},{"attrs":{"k0":0,"kt":256,"source_k_loop":{"k_tail":1,"logical_k":257,"lowering_k_tile":256,"narrowing_base":"every 256 K elements","pipeline_hint_dropped":false,"source_k_block":256,"source_k_trips":2,"source_loop_annotations":{},"tail_contract":{"form":"guarded_rect_tail_v1","grid":{"x":1,"y":1},"guarded_reads":{"A":[13,257],"B":[257,33]},"guarded_write":[13,33],"k_trips":2,"tails":{"K":1,"M":13,"N":33},"tiles":{"K":256,"M":16,"N":64},"zero_fill":["A_tile_each_k_iteration","B_tile_each_k_iteration"]}},"source_mn_tiling":{"block_m":16,"block_n":64,"coverage":"ragged_tail","grid_x":1,"grid_y":1,"m_tail":13,"n_tail":33},"submit_group":"mm:0:0"},"deps":[0,1,2,3],"id":4,"inputs":[0,1],"kind":"npu_task","origin":"lowering:matmul:0","outputs":[4],"template_id":"co.mm.f16.v1"},{"attrs":{"k0":256,"kt":1,"source_k_loop":{"k_tail":1,"logical_k":257,"lowering_k_tile":256,"narrowing_base":"every 256 K elements","pipeline_hint_dropped":false,"source_k_block":256,"source_k_trips":2,"source_loop_annotations":{},"tail_contract":{"form":"guarded_rect_tail_v1","grid":{"x":1,"y":1},"guarded_reads":{"A":[13,257],"B":[257,33]},"guarded_write":[13,33],"k_trips":2,"tails":{"K":1,"M":13,"N":33},"tiles":{"K":256,"M":16,"N":64},"zero_fill":["A_tile_each_k_iteration","B_tile_each_k_iteration"]}},"source_mn_tiling":{"block_m":16,"block_n":64,"coverage":"ragged_tail","grid_x":1,"grid_y":1,"m_tail":13,"n_tail":33},"submit_group":"mm:0:0"},"deps":[4],"id":5,"inputs":[2,3,4],"kind":"npu_task","origin":"lowering:matmul_acc:256","outputs":[5],"template_id":"co.mm_acc.f16.v1"},{"attrs":{"binding_id":2,"submit_group":null},"deps":[5],"id":6,"inputs":[5],"kind":"download","origin":"host:download","outputs":[],"template_id":null}],"bindings":[{"dtype":"float16","id":0,"name":"A","role":"input","shape":[13,257]},{"dtype":"float16","id":1,"name":"B","role":"constant","shape":[257,33]},{"dtype":"float16","id":2,"name":"C","role":"output","shape":[13,33]}],"buffers":[{"alignment":16,"capacity":8192,"id":0,"layout_id":"co.cube.f16.v1","lifetime":[0,4],"must_not_share_bo":[],"offset":0,"padding_state":"zero","role":"input_slice","slot_id":0},{"alignment":16,"capacity":32768,"id":1,"layout_id":"co.weight.f16.v1","lifetime":[1,4],"must_not_share_bo":[],"offset":0,"padding_state":"zero","role":"weight","slot_id":1},{"alignment":16,"capacity":1024,"id":2,"layout_id":"co.cube.f16.v1","lifetime":[2,5],"must_not_share_bo":[],"offset":0,"padding_state":"zero","role":"input_slice","slot_id":2},{"alignment":16,"capacity":4096,"id":3,"layout_id":"co.weight.f16.v1","lifetime":[3,5],"must_not_share_bo":[],"offset":0,"padding_state":"zero","role":"weight","slot_id":3},{"alignment":16,"capacity":2048,"id":4,"layout_id":"co.cube.f16.v1","lifetime":[4,5],"must_not_share_bo":[],"offset":0,"padding_state":"finite","role":"accumulator","slot_id":4},{"alignment":16,"capacity":2048,"id":5,"layout_id":"co.cube.f16.v1","lifetime":[5,6],"must_not_share_bo":[],"offset":0,"padding_state":"finite","role":"output","slot_id":5}],"constants":[{"binding_id":1,"dtype":"float16","name":"B","nbytes":16962,"pack_key":"f16:host-contract:257x33:v1","sha256":"28db96f1d81a06fe6c195735268a450ad6d8f8d3068b83df6c9ef72be742b77f","shape":[257,33]}],"kind":"rkplan","name":"tilelang:kernel","plan_hash":"51846b86dff28bad1af8966ba2049d5cde34d682bafe726545263cd3d3918994","profile_hash":"954d071351959ddbe2bb7351de196c6b45f6b5bcd6f81f603b649e3e62eb692d","publish":[{"binding_id":2,"cols":33,"dst_col":0,"dst_row":0,"name":"C","rows":13,"view_id":5}],"schema_version":2,"source_hash":"Span(SourceName(/home/maoyu/Documents/code/rockchip-npu-notes/research/tilelang-rknpu/tests/fixtures/tilelang_ragged.py, 0x1df8ad20), 19, 19, 1, 1048576)","submits":[{"core_policy":"single_core_per_submit","deps":[],"id":0,"mode":"separate","recipe_id":"linear_k_acc_v1","task_ids":[4]},{"core_policy":"single_core_per_submit","deps":[0],"id":1,"mode":"separate","recipe_id":"linear_k_acc_v1","task_ids":[5]}],"views":[{"buffer_id":0,"id":0,"offset_bytes":0,"tensor":{"atom":8,"bytes":8192,"cols":256,"dtype":"float16","layout":"co.cube.f16.v1","physical_cols":256,"physical_rows":16,"rows":13},"valid_region":[0,13,0,256]},{"buffer_id":1,"id":1,"offset_bytes":0,"tensor":{"atom":32,"bytes":32768,"cols":256,"dtype":"float16","layout":"co.weight.f16.v1","physical_cols":256,"physical_rows":64,"rows":33},"valid_region":[0,33,0,256]},{"buffer_id":2,"id":2,"offset_bytes":0,"tensor":{"atom":8,"bytes":1024,"cols":1,"dtype":"float16","layout":"co.cube.f16.v1","physical_cols":32,"physical_rows":16,"rows":13},"valid_region":[0,13,0,1]},{"buffer_id":3,"id":3,"offset_bytes":0,"tensor":{"atom":32,"bytes":4096,"cols":1,"dtype":"float16","layout":"co.weight.f16.v1","physical_cols":32,"physical_rows":64,"rows":33},"valid_region":[0,33,0,1]},{"buffer_id":4,"id":4,"offset_bytes":0,"tensor":{"atom":8,"bytes":2048,"cols":33,"dtype":"float16","layout":"co.cube.f16.v1","physical_cols":64,"physical_rows":16,"rows":13},"valid_region":[0,13,0,33]},{"buffer_id":5,"id":5,"offset_bytes":0,"tensor":{"atom":8,"bytes":2048,"cols":33,"dtype":"float16","layout":"co.cube.f16.v1","physical_cols":64,"physical_rows":16,"rows":13},"valid_region":[0,13,0,33]}]}