{"accounting":{"command_workspace_bytes":32768,"data_bo_count":6,"device_request_bytes":336256,"host_bytes":205292,"peak_payload_bytes":106496,"reserved_bytes":303488,"submit_count":1,"task_count":2,"transfers":5},"actions":[{"attrs":{"cache":"input","source_binding":0,"src_col_offset":0,"src_row_offset":0,"src_row_stride":128,"transpose_source":false},"deps":[],"id":0,"inputs":[],"kind":"upload","origin":"host_pack:input","outputs":[0],"template_id":null},{"attrs":{"cache":"constant","source_binding":1,"src_col_offset":0,"src_row_offset":0,"src_row_stride":64,"transpose_source":true},"deps":[],"id":1,"inputs":[],"kind":"upload","origin":"host_pack:weight","outputs":[1],"template_id":null},{"attrs":{"cache":"input","source_binding":2,"src_col_offset":0,"src_row_offset":0,"src_row_stride":64,"transpose_source":false},"deps":[],"id":2,"inputs":[],"kind":"upload","origin":"host_pack:binary_operand","outputs":[3],"template_id":null},{"attrs":{"cache":"constant","source_binding":4,"src_col_offset":0,"src_row_offset":0,"src_row_stride":64,"transpose_source":false},"deps":[],"id":3,"inputs":[],"kind":"upload","origin":"lowering:identity","outputs":[4],"template_id":null},{"attrs":{"k0":0,"kt":128,"source_k_loop":null,"source_mn_tiling":null,"submit_group":"mm:0:0"},"deps":[0,1],"id":4,"inputs":[0,1],"kind":"npu_task","origin":"lowering:matmul:0","outputs":[2],"template_id":"co.mm.f16.v1"},{"attrs":{"submit_group":"ew:0:0"},"deps":[4,2,3],"id":5,"inputs":[2,3,4],"kind":"npu_task","origin":"lowering:add","outputs":[5],"template_id":"co.ew_add.f16.v1"},{"attrs":{"binding_id":3,"submit_group":null},"deps":[5],"id":6,"inputs":[5],"kind":"download","origin":"host:download","outputs":[],"template_id":null}],"bindings":[{"dtype":"float16","id":0,"name":"A","role":"input","shape":[128,128]},{"dtype":"float16","id":1,"name":"B","role":"constant","shape":[128,64]},{"dtype":"float16","id":2,"name":"R","role":"input","shape":[128,64]},{"dtype":"float16","id":3,"name":"Y","role":"output","shape":[128,64]},{"dtype":"float16","id":4,"name":"__identity_64","role":"constant","shape":[64,64]}],"budget_policy":{"device_budget_bytes":268435456,"host_budget_bytes":268435456,"schema_version":1},"buffers":[{"alignment":16,"capacity":32768,"id":0,"layout_id":"co.cube.f16.v1","lifetime":[0,4],"must_not_share_bo":[],"offset":0,"padding_state":"zero","role":"input_slice","slot_id":0},{"alignment":16,"capacity":16384,"id":1,"layout_id":"co.weight.f16.v1","lifetime":[1,4],"must_not_share_bo":[],"offset":0,"padding_state":"zero","role":"weight","slot_id":1},{"alignment":16,"capacity":16384,"id":2,"layout_id":"co.cube.f16.v1","lifetime":[4,5],"must_not_share_bo":[],"offset":0,"padding_state":"finite","role":"output","slot_id":2},{"alignment":16,"capacity":16384,"id":3,"layout_id":"co.cube.f16.v1","lifetime":[2,5],"must_not_share_bo":[],"offset":0,"padding_state":"zero","role":"input_slice","slot_id":3},{"alignment":16,"capacity":8192,"id":4,"layout_id":"co.weight.f16.v1","lifetime":[3,5],"must_not_share_bo":[],"offset":0,"padding_state":"zero","role":"identity","slot_id":4},{"alignment":16,"capacity":16384,"id":5,"layout_id":"co.cube.f16.v1","lifetime":[5,6],"must_not_share_bo":[],"offset":0,"padding_state":"finite","role":"output","slot_id":5}],"constants":[{"binding_id":1,"dtype":"float16","name":"B","nbytes":16384,"pack_key":"f16:host-contract:128x64:v1","sha256":"cc21ea6db67809728a7b0a0984ee8739bd4b5871a75c72310eae1cdfd85e7fe3","shape":[128,64]},{"binding_id":4,"dtype":"float16","generator":"identity","name":"__identity_64","nbytes":8192,"pack_key":"identity:f16:64:v1","sha256":"90fca671e478c0442955ebf59e432ea8abddccd315c2b722b9436a4a0f92f0a5","shape":[64,64]}],"kind":"rkplan","name":"tiny_vit_b8_down_add","plan_hash":"c1b55b4f87aa0e882a85894ecb2c4d9b2a6476dfcbf165c35da0eadd9dcce6e1","profile_hash":"7ef710bb19372e71f15994f363bd2542b4ef39b1ad35a36fa6ec787e61461dd1","publish":[{"binding_id":3,"cols":64,"dst_col":0,"dst_row":0,"name":"Y","rows":128,"view_id":5}],"schema_version":2,"source_hash":"builder","submits":[{"core_policy":"single_core_per_submit","deps":[],"id":0,"mode":"chain","recipe_id":"linear_epilogue_v1","task_ids":[4,5]}],"views":[{"buffer_id":0,"id":0,"offset_bytes":0,"tensor":{"atom":8,"bytes":32768,"cols":128,"dtype":"float16","layout":"co.cube.f16.v1","physical_cols":128,"physical_rows":128,"rows":128},"valid_region":[0,128,0,128]},{"buffer_id":1,"id":1,"offset_bytes":0,"tensor":{"atom":32,"bytes":16384,"cols":128,"dtype":"float16","layout":"co.weight.f16.v1","physical_cols":128,"physical_rows":64,"rows":64},"valid_region":[0,64,0,128]},{"buffer_id":2,"id":2,"offset_bytes":0,"tensor":{"atom":8,"bytes":16384,"cols":64,"dtype":"float16","layout":"co.cube.f16.v1","physical_cols":64,"physical_rows":128,"rows":128},"valid_region":[0,128,0,64]},{"buffer_id":3,"id":3,"offset_bytes":0,"tensor":{"atom":8,"bytes":16384,"cols":64,"dtype":"float16","layout":"co.cube.f16.v1","physical_cols":64,"physical_rows":128,"rows":128},"valid_region":[0,128,0,64]},{"buffer_id":4,"id":4,"offset_bytes":0,"tensor":{"atom":32,"bytes":8192,"cols":64,"dtype":"float16","layout":"co.weight.f16.v1","physical_cols":64,"physical_rows":64,"rows":64},"valid_region":[0,64,0,64]},{"buffer_id":5,"id":5,"offset_bytes":0,"tensor":{"atom":8,"bytes":16384,"cols":64,"dtype":"float16","layout":"co.cube.f16.v1","physical_cols":64,"physical_rows":128,"rows":128},"valid_region":[0,128,0,64]}]}