{"accounting":{"broadcast_expand_bytes":1536,"command_workspace_bytes":16384,"data_bo_count":6,"device_request_bytes":235904,"host_bytes":81106,"peak_payload_bytes":22528,"reserved_bytes":219520,"submit_count":2,"task_count":2,"transfers":5},"actions":[{"attrs":{"cache":"input","source_binding":0,"src_col_offset":0,"src_row_offset":0,"src_row_stride":64,"transpose_source":false},"deps":[],"id":0,"inputs":[],"kind":"upload","origin":"host_pack:dataflow","outputs":[0],"template_id":null},{"attrs":{"cache":"constant","source_binding":1,"src_col_offset":0,"src_row_offset":0,"src_row_stride":33,"transpose_source":true},"deps":[],"id":1,"inputs":[],"kind":"upload","origin":"host_pack:dataflow","outputs":[1],"template_id":null},{"attrs":{"broadcast":"channel","broadcast_target":[8,33],"cache":"constant","source_binding":2,"src_col_offset":0,"src_row_offset":0,"src_row_stride":0,"transpose_source":false},"deps":[],"id":2,"inputs":[],"kind":"upload","origin":"host_pack:dataflow","outputs":[2],"template_id":null},{"attrs":{"cache":"constant","source_binding":4,"src_col_offset":0,"src_row_offset":0,"src_row_stride":64,"transpose_source":false},"deps":[],"id":3,"inputs":[],"kind":"upload","origin":"lowering:identity","outputs":[3],"template_id":null},{"attrs":{"k0":0,"kt":64,"source_k_loop":null,"submit_group":"mm:dataflow:0"},"deps":[0,1],"id":4,"inputs":[0,1],"kind":"npu_task","origin":"lowering:dataflow:matmul:0","outputs":[4],"template_id":"co.mm.f16.v1"},{"attrs":{"submit_group":"ew:dataflow:1"},"deps":[4,2,3],"id":5,"inputs":[4,2,3],"kind":"npu_task","origin":"lowering:dataflow:add","outputs":[5],"template_id":"co.ew_add.f16.v1"},{"attrs":{"binding_id":3,"submit_group":null},"deps":[5],"id":6,"inputs":[5],"kind":"download","origin":"host:download","outputs":[],"template_id":null}],"bindings":[{"dtype":"float16","id":0,"name":"X","role":"input","shape":[8,64]},{"dtype":"float16","id":1,"name":"W","role":"constant","shape":[64,33]},{"dtype":"float16","id":2,"name":"B","role":"constant","shape":[33]},{"dtype":"float16","id":3,"name":"Y","role":"output","shape":[8,33]},{"dtype":"float16","id":4,"name":"__identity_64","role":"constant","shape":[64,64]}],"buffers":[{"alignment":16,"capacity":1536,"id":0,"layout_id":"co.cube.f16.v1","lifetime":[0,4],"must_not_share_bo":[],"offset":0,"padding_state":"zero","role":"input_slice","slot_id":0},{"alignment":16,"capacity":8192,"id":1,"layout_id":"co.weight.f16.v1","lifetime":[1,4],"must_not_share_bo":[],"offset":0,"padding_state":"zero","role":"weight","slot_id":1},{"alignment":16,"capacity":1536,"id":2,"layout_id":"co.cube.f16.v1","lifetime":[2,5],"must_not_share_bo":[],"offset":0,"padding_state":"zero","role":"input_slice","slot_id":2},{"alignment":16,"capacity":8192,"id":3,"layout_id":"co.weight.f16.v1","lifetime":[3,5],"must_not_share_bo":[],"offset":0,"padding_state":"zero","role":"identity","slot_id":3},{"alignment":16,"capacity":1536,"id":4,"layout_id":"co.cube.f16.v1","lifetime":[4,5],"must_not_share_bo":[],"offset":0,"padding_state":"finite","role":"accumulator","slot_id":4},{"alignment":16,"capacity":1536,"id":5,"layout_id":"co.cube.f16.v1","lifetime":[5,6],"must_not_share_bo":[],"offset":0,"padding_state":"finite","role":"output","slot_id":5}],"constants":[{"binding_id":1,"dtype":"float16","name":"W","nbytes":4224,"pack_key":"f16:host-contract:64x33:v1","sha256":"b20e372862bacecd8bcbc4eaa2427450503ecf5d96358a5e2b55468cb0512324","shape":[64,33]},{"binding_id":2,"dtype":"float16","name":"B","nbytes":66,"pack_key":"f16:host-contract:33:v1","sha256":"24edc653301bbd6015a550bb1a4ba930799ad193614f3f3fd2dfc5aa14bb4fea","shape":[33]},{"binding_id":4,"dtype":"float16","generator":"identity","name":"__identity_64","nbytes":8192,"pack_key":"identity:f16:64:v1","sha256":"90fca671e478c0442955ebf59e432ea8abddccd315c2b722b9436a4a0f92f0a5","shape":[64,64]}],"kind":"rkplan","name":"tilelang:kernel","plan_hash":"cebf189fbe4d533e2875a50a5d0e09f447b9554c6a1143da5a5a5f471b5b79dc","profile_hash":"954d071351959ddbe2bb7351de196c6b45f6b5bcd6f81f603b649e3e62eb692d","publish":[{"binding_id":3,"cols":33,"dst_col":0,"dst_row":0,"name":"Y","rows":8,"view_id":5}],"schema_version":2,"source_hash":"Span(SourceName(/home/maoyu/Documents/code/rockchip-npu-notes/research/tilelang-rknpu/tests/fixtures/tilelang_broadcast.py, 0x26fff4e0), 15, 15, 1, 1048576)","submits":[{"core_policy":"single_core_per_submit","deps":[],"id":0,"mode":"separate","recipe_id":"linear_k_acc_v1","task_ids":[4]},{"core_policy":"single_core_per_submit","deps":[0],"id":1,"mode":"separate","recipe_id":"gate_ew_v1","task_ids":[5]}],"views":[{"buffer_id":0,"id":0,"offset_bytes":0,"tensor":{"atom":8,"bytes":1536,"cols":64,"dtype":"float16","layout":"co.cube.f16.v1","physical_cols":64,"physical_rows":12,"rows":8},"valid_region":[0,8,0,64]},{"buffer_id":1,"id":1,"offset_bytes":0,"tensor":{"atom":32,"bytes":8192,"cols":64,"dtype":"float16","layout":"co.weight.f16.v1","physical_cols":64,"physical_rows":64,"rows":33},"valid_region":[0,33,0,64]},{"buffer_id":2,"id":2,"offset_bytes":0,"tensor":{"atom":8,"bytes":1536,"cols":33,"dtype":"float16","layout":"co.cube.f16.v1","physical_cols":64,"physical_rows":12,"rows":8},"valid_region":[0,8,0,33]},{"buffer_id":3,"id":3,"offset_bytes":0,"tensor":{"atom":32,"bytes":8192,"cols":64,"dtype":"float16","layout":"co.weight.f16.v1","physical_cols":64,"physical_rows":64,"rows":64},"valid_region":[0,64,0,64]},{"buffer_id":4,"id":4,"offset_bytes":0,"tensor":{"atom":8,"bytes":1536,"cols":33,"dtype":"float16","layout":"co.cube.f16.v1","physical_cols":64,"physical_rows":12,"rows":8},"valid_region":[0,8,0,33]},{"buffer_id":5,"id":5,"offset_bytes":0,"tensor":{"atom":8,"bytes":1536,"cols":33,"dtype":"float16","layout":"co.cube.f16.v1","physical_cols":64,"physical_rows":12,"rows":8},"valid_region":[0,8,0,33]}]}