{"accounting":{"command_workspace_bytes":32768,"data_bo_count":6,"device_request_bytes":391552,"host_bytes":234988,"peak_payload_bytes":161792,"reserved_bytes":358784,"submit_count":1,"task_count":2,"transfers":5},"actions":[{"attrs":{"cache":"constant","source_binding":0,"src_col_offset":0,"src_row_offset":0,"src_row_stride":256,"transpose_source":false},"deps":[],"id":0,"inputs":[],"kind":"upload","origin":"host_pack:dataflow","outputs":[0],"template_id":null},{"attrs":{"cache":"constant","source_binding":1,"src_col_offset":0,"src_row_offset":0,"src_row_stride":256,"transpose_source":false},"deps":[],"id":1,"inputs":[],"kind":"upload","origin":"host_pack:dataflow","outputs":[1],"template_id":null},{"attrs":{"cache":"constant","source_binding":3,"src_col_offset":0,"src_row_offset":0,"src_row_stride":256,"transpose_source":false},"deps":[],"id":2,"inputs":[],"kind":"upload","origin":"lowering:identity","outputs":[2],"template_id":null},{"attrs":{"cache":"constant","source_binding":4,"src_col_offset":0,"src_row_offset":0,"src_row_stride":256,"transpose_source":false},"deps":[],"id":3,"inputs":[],"kind":"upload","origin":"lowering:zero","outputs":[3],"template_id":null},{"attrs":{"submit_group":"ew:dataflow:0"},"deps":[0,1,2],"id":4,"inputs":[0,1,2],"kind":"npu_task","origin":"lowering:dataflow:add","outputs":[4],"template_id":"co.ew_add.f16.v1"},{"attrs":{"submit_group":"act:dataflow:1"},"deps":[4,3,2],"id":5,"inputs":[4,3,2],"kind":"npu_task","origin":"lowering:relu","outputs":[5],"template_id":"co.ew_max.f16.v1"},{"attrs":{"binding_id":2,"submit_group":null},"deps":[5],"id":6,"inputs":[5],"kind":"download","origin":"host:download","outputs":[],"template_id":null}],"bindings":[{"dtype":"float16","id":0,"name":"X","role":"constant","shape":[2,256]},{"dtype":"float16","id":1,"name":"B","role":"constant","shape":[2,256]},{"dtype":"float16","id":2,"name":"Y","role":"output","shape":[2,256]},{"dtype":"float16","id":3,"name":"__identity_256","role":"constant","shape":[256,256]},{"dtype":"float16","id":4,"name":"__zero_2x256","role":"constant","shape":[2,256]}],"budget_policy":{"device_budget_bytes":268435456,"host_budget_bytes":268435456,"schema_version":1},"buffers":[{"alignment":16,"capacity":6144,"id":0,"layout_id":"co.cube.f16.v1","lifetime":[0,4],"must_not_share_bo":[],"offset":0,"padding_state":"zero","role":"input_slice","slot_id":0},{"alignment":16,"capacity":6144,"id":1,"layout_id":"co.cube.f16.v1","lifetime":[1,4],"must_not_share_bo":[],"offset":0,"padding_state":"zero","role":"input_slice","slot_id":1},{"alignment":16,"capacity":131072,"id":2,"layout_id":"co.weight.f16.v1","lifetime":[2,5],"must_not_share_bo":[],"offset":0,"padding_state":"zero","role":"identity","slot_id":2},{"alignment":16,"capacity":6144,"id":3,"layout_id":"co.cube.f16.v1","lifetime":[3,5],"must_not_share_bo":[],"offset":0,"padding_state":"zero","role":"constant","slot_id":3},{"alignment":16,"capacity":6144,"id":4,"layout_id":"co.cube.f16.v1","lifetime":[4,5],"must_not_share_bo":[],"offset":0,"padding_state":"finite","role":"workspace","slot_id":4},{"alignment":16,"capacity":6144,"id":5,"layout_id":"co.cube.f16.v1","lifetime":[5,6],"must_not_share_bo":[],"offset":0,"padding_state":"finite","role":"output","slot_id":5}],"constants":[{"binding_id":0,"dtype":"float16","name":"X","nbytes":1024,"pack_key":"f16:host-contract:2x256:v1","sha256":"50ff87fe1f2f59f3fdef72606d03e4c110dc76bdc4f92892189d7f6556f8e0e4","shape":[2,256]},{"binding_id":1,"dtype":"float16","name":"B","nbytes":1024,"pack_key":"f16:host-contract:2x256:v1","sha256":"2f0900d3c8170a127c35d4831c70eecbb85fa1326475173e6b4aadaaa67b38cf","shape":[2,256]},{"binding_id":3,"dtype":"float16","generator":"identity","name":"__identity_256","nbytes":131072,"pack_key":"identity:f16:256:v1","sha256":"135f0a0f0a4a0cde0300b67f5070eb8f10d7390e81b7271f8f0d852403efcf99","shape":[256,256]},{"binding_id":4,"dtype":"float16","generator":"zero","name":"__zero_2x256","nbytes":1024,"pack_key":"zero:f16:2x256:v1","sha256":"5f70bf18a086007016e948b04aed3b82103a36bea41755b6cddfaf10ace3c6ef","shape":[2,256]}],"kind":"rkplan","name":"tilelang:mnist_relu_probe","plan_hash":"493417add82f803940ec00f2d64592cea0786babb0ddd6922bb324be86ce57a4","profile_hash":"c6b8d3e71acaf317a37a21d186cc7252c3ca7e0e61d201da12aba35480bddaf6","publish":[{"binding_id":2,"cols":256,"dst_col":0,"dst_row":0,"name":"Y","rows":2,"view_id":5}],"schema_version":2,"source_hash":"Span(SourceName(models/tilelang_mlp.py#sha256:a244daf9933972a8, 0x0), 135, 135, 1, 1048576)","submits":[{"core_policy":"single_core_per_submit","deps":[],"id":0,"mode":"chain","recipe_id":"ew_add_relu_v1","task_ids":[4,5]}],"views":[{"buffer_id":0,"id":0,"offset_bytes":0,"tensor":{"atom":8,"bytes":6144,"cols":256,"dtype":"float16","layout":"co.cube.f16.v1","physical_cols":256,"physical_rows":12,"rows":2},"valid_region":[0,2,0,256]},{"buffer_id":1,"id":1,"offset_bytes":0,"tensor":{"atom":8,"bytes":6144,"cols":256,"dtype":"float16","layout":"co.cube.f16.v1","physical_cols":256,"physical_rows":12,"rows":2},"valid_region":[0,2,0,256]},{"buffer_id":2,"id":2,"offset_bytes":0,"tensor":{"atom":32,"bytes":131072,"cols":256,"dtype":"float16","layout":"co.weight.f16.v1","physical_cols":256,"physical_rows":256,"rows":256},"valid_region":[0,256,0,256]},{"buffer_id":3,"id":3,"offset_bytes":0,"tensor":{"atom":8,"bytes":6144,"cols":256,"dtype":"float16","layout":"co.cube.f16.v1","physical_cols":256,"physical_rows":12,"rows":2},"valid_region":[0,2,0,256]},{"buffer_id":4,"id":4,"offset_bytes":0,"tensor":{"atom":8,"bytes":6144,"cols":256,"dtype":"float16","layout":"co.cube.f16.v1","physical_cols":256,"physical_rows":12,"rows":2},"valid_region":[0,2,0,256]},{"buffer_id":5,"id":5,"offset_bytes":0,"tensor":{"atom":8,"bytes":6144,"cols":256,"dtype":"float16","layout":"co.cube.f16.v1","physical_cols":256,"physical_rows":12,"rows":2},"valid_region":[0,2,0,256]}]}