{"accounting":{"command_workspace_bytes":16384,"data_bo_count":5,"device_request_bytes":201536,"host_bytes":78080,"peak_payload_bytes":20992,"reserved_bytes":185152,"submit_count":2,"task_count":2,"transfers":5},"actions":[{"attrs":{"cache":"input","source_binding":0,"src_col_offset":0,"src_row_offset":0,"src_row_stride":64,"transpose_source":false},"deps":[],"id":0,"inputs":[],"kind":"upload","origin":"host_pack:dataflow","outputs":[0],"template_id":null},{"attrs":{"cache":"constant","source_binding":1,"src_col_offset":0,"src_row_offset":0,"src_row_stride":33,"transpose_source":true},"deps":[],"id":1,"inputs":[],"kind":"upload","origin":"host_pack:dataflow","outputs":[1],"template_id":null},{"attrs":{"cache":"constant","source_binding":2,"src_col_offset":0,"src_row_offset":0,"src_row_stride":47,"transpose_source":true},"deps":[],"id":2,"inputs":[],"kind":"upload","origin":"host_pack:dataflow","outputs":[2],"template_id":null},{"attrs":{"k0":0,"kt":64,"source_k_loop":null,"submit_group":"mm:dataflow:0"},"deps":[0,1],"id":3,"inputs":[0,1],"kind":"npu_task","origin":"lowering:dataflow:matmul:0","outputs":[3],"template_id":"co.mm.f16.v1"},{"attrs":{"k0":0,"kt":64,"source_k_loop":null,"submit_group":"mm:dataflow:1"},"deps":[0,2],"id":4,"inputs":[0,2],"kind":"npu_task","origin":"lowering:dataflow:matmul:1","outputs":[4],"template_id":"co.mm.f16.v1"},{"attrs":{"binding_id":3,"submit_group":null},"deps":[3],"id":5,"inputs":[3],"kind":"download","origin":"host:download","outputs":[],"template_id":null},{"attrs":{"binding_id":4,"submit_group":null},"deps":[4],"id":6,"inputs":[4],"kind":"download","origin":"host:download","outputs":[],"template_id":null}],"bindings":[{"dtype":"float16","id":0,"name":"X","role":"input","shape":[8,64]},{"dtype":"float16","id":1,"name":"W1","role":"constant","shape":[64,33]},{"dtype":"float16","id":2,"name":"W2","role":"constant","shape":[64,47]},{"dtype":"float16","id":3,"name":"Y1","role":"output","shape":[8,33]},{"dtype":"float16","id":4,"name":"Y2","role":"output","shape":[8,47]}],"buffers":[{"alignment":16,"capacity":1536,"id":0,"layout_id":"co.cube.f16.v1","lifetime":[0,4],"must_not_share_bo":[],"offset":0,"padding_state":"zero","role":"input_slice","slot_id":0},{"alignment":16,"capacity":8192,"id":1,"layout_id":"co.weight.f16.v1","lifetime":[1,3],"must_not_share_bo":[],"offset":0,"padding_state":"zero","role":"weight","slot_id":1},{"alignment":16,"capacity":8192,"id":2,"layout_id":"co.weight.f16.v1","lifetime":[2,4],"must_not_share_bo":[],"offset":0,"padding_state":"zero","role":"weight","slot_id":2},{"alignment":16,"capacity":1536,"id":3,"layout_id":"co.cube.f16.v1","lifetime":[3,5],"must_not_share_bo":[],"offset":0,"padding_state":"finite","role":"output","slot_id":3},{"alignment":16,"capacity":1536,"id":4,"layout_id":"co.cube.f16.v1","lifetime":[4,6],"must_not_share_bo":[],"offset":0,"padding_state":"finite","role":"output","slot_id":4}],"constants":[{"binding_id":1,"dtype":"float16","name":"W1","nbytes":4224,"pack_key":"f16:host-contract:64x33:v1","sha256":"0ee24c667ddc7e328f9119f84ff126de12b1b6f761dce7714c48243c5dd9f56a","shape":[64,33]},{"binding_id":2,"dtype":"float16","name":"W2","nbytes":6016,"pack_key":"f16:host-contract:64x47:v1","sha256":"67b045d7174ea2d06e97009628d112aae98832c3c4358b189ccd3b1688c8c7f0","shape":[64,47]}],"kind":"rkplan","name":"tilelang:kernel","plan_hash":"dd009f9b099cd60598ae886c43fee94af161b04b219dc3e505cadd4b425399fa","profile_hash":"954d071351959ddbe2bb7351de196c6b45f6b5bcd6f81f603b649e3e62eb692d","publish":[{"binding_id":3,"cols":33,"dst_col":0,"dst_row":0,"name":"Y1","rows":8,"view_id":3},{"binding_id":4,"cols":47,"dst_col":0,"dst_row":0,"name":"Y2","rows":8,"view_id":4}],"schema_version":2,"source_hash":"Span(SourceName(/home/maoyu/Documents/code/rockchip-npu-notes/research/tilelang-rknpu/tests/fixtures/tilelang_multi_output.py, 0x27e57440), 16, 16, 1, 1048576)","submits":[{"core_policy":"single_core_per_submit","deps":[],"id":0,"mode":"chain","recipe_id":"linear_k_acc_v1","task_ids":[3]},{"core_policy":"single_core_per_submit","deps":[0],"id":1,"mode":"chain","recipe_id":"linear_k_acc_v1","task_ids":[4]}],"views":[{"buffer_id":0,"id":0,"offset_bytes":0,"tensor":{"atom":8,"bytes":1536,"cols":64,"dtype":"float16","layout":"co.cube.f16.v1","physical_cols":64,"physical_rows":12,"rows":8},"valid_region":[0,8,0,64]},{"buffer_id":1,"id":1,"offset_bytes":0,"tensor":{"atom":32,"bytes":8192,"cols":64,"dtype":"float16","layout":"co.weight.f16.v1","physical_cols":64,"physical_rows":64,"rows":33},"valid_region":[0,33,0,64]},{"buffer_id":2,"id":2,"offset_bytes":0,"tensor":{"atom":32,"bytes":8192,"cols":64,"dtype":"float16","layout":"co.weight.f16.v1","physical_cols":64,"physical_rows":64,"rows":47},"valid_region":[0,47,0,64]},{"buffer_id":3,"id":3,"offset_bytes":0,"tensor":{"atom":8,"bytes":1536,"cols":33,"dtype":"float16","layout":"co.cube.f16.v1","physical_cols":64,"physical_rows":12,"rows":8},"valid_region":[0,8,0,33]},{"buffer_id":4,"id":4,"offset_bytes":0,"tensor":{"atom":8,"bytes":1536,"cols":47,"dtype":"float16","layout":"co.cube.f16.v1","physical_cols":64,"physical_rows":12,"rows":8},"valid_region":[0,8,0,47]}]}